{
  "schemaVersion": 1,
  "problemId": "bssc-sum-capacity",
  "subjectTransactionId": "c70e1829a7c6a2a8cb8cfc2383f8abf825ac5ea6",
  "ledgerOrdinal": 3,
  "judgmentId": "sha256:6811dbc06c253fd81a1d9244887b661fff26b22c3cdcda708cd6bdf5642a7293",
  "acceptedClaims": [
    {
      "claimKey": "bssc-sum-capacity/code-induced-dependence-balance-and-entropy-no-go",
      "statement": "This is an attributed, independently audited port of the consecutive accepted\nYukon artifacts `upper-dependence-balance` and `upper-entropy-nogo`.  They form\none dependency-complete structural result: the first derives a necessary\ncondition from every deterministic private-message code, and the second proves\nthat a specified entropy-only relaxation of that condition cannot improve the\nclassical UV value.\n\n### Finite-block code-induced balance\n\nLet (A) and (B) be independent uniform private messages, encoded\ndeterministically over (n) uses of a finite-alphabet memoryless broadcast\nchannel.  Receiver (Y) estimates (A) with average error (p_1), and\nreceiver (Z) estimates (B) with error (p_2).  Define\n\n\\[\nF_j=h_2(p_j)+p_j\\log_2(N_j-1),\\qquad \\delta_j=F_j/n.\n\\]\n\nFor\n\n\\[\nS_i=(Y^{i-1},Z_{i+1}^n),\n\\]\n\nthe exact telescope is\n\n\\[\n\\sum_{i=1}^n\n\\left[I(A;B\\mid S_i,Y_i)-I(A;B\\mid S_i,Z_i)\\right]\n=I(A;B\\mid Y^n)-I(A;B\\mid Z^n).\n\\]\n\nBoth endpoints are nonnegative, while Fano bounds them by (F_1) and\n(F_2), respectively.  With independent uniform time (T), and\n\n\\[\nU=A,\\quad V=B,\\quad W=S_T,\\quad X=X_T,\\quad Y=Y_T,\\quad Z=Z_T,\n\\]\n\nevery such code therefore induces\n\n\\[\n\\left|I(U;V\\mid W,T,Y)-I(U;V\\mid W,T,Z)\\right|\n\\le\\max\\{\\delta_1,\\delta_2\\}.\n\\]\n\nThe complete induced law retains the fixed coordinate map:\n\n\\[\np(t,u,v,w,x,y,z)=\\frac1n p_U(u)p_V(v)p(w\\mid u,v,t)\n\\mathbf 1\\{x=f_t(u,v)\\}P_{YZ\\mid X}(y,z\\mid x).\n\\]\n\nIn particular, (U\\perp V), (T\\perp(U,V)), (X=f_T(U,V)), and the\nrealized state (W) cannot select another encoder map after (u,v,t) are\nfixed.  The same variables satisfy four compatible rate rows:\n\n\\[\n\\begin{aligned}\nR_1&\\le I(U,W;Y\\mid T)+\\delta_1,\\\\\nR_2&\\le I(V,W;Z\\mid T)+\\delta_2,\\\\\nR_1+R_2&\\le I(U,W;Y\\mid T)+I(X;Z\\mid U,W,T)+\\delta_1+\\delta_2,\\\\\nR_1+R_2&\\le I(V,W;Z\\mid T)+I(X;Y\\mid V,W,T)+\\delta_1+\\delta_2.\n\\end{aligned}\n\\]\n\nThis is an exact sequence-level necessary condition.  The alphabets of the\nmessages and (W) grow with blocklength, so it is not by itself a fixed-\ncardinality single-letter outer region.\n\n### Exact entropy/copy no-go theorem\n\nAt uniform input, put\n\n\\[\nh=h_2(1/4),\\qquad c=h-1/2,\\qquad r=h-3/4.\n\\]\n\nConsider the coarse entropy relaxation that imposes:\n\n- the complete seven nonempty entropies of the common-noise BSSC coupling,\n  namely (H(X)=1), (H(Y)=H(Z)=h),\n  (H(X,Y)=H(X,Z)=H(Y,Z)=3/2), and (H(X,Y,Z)=2);\n- message/time independence, deterministic encoding, the fixed-map equality,\n  the memoryless Markov equality, and exact dependence balance;\n- every conditional BEC identity\n  (I(L;Y,Z\\mid K)=\\tfrac12I(L;X\\mid K)) for disjoint subtuples\n  (L,K\\subseteq\\{U,V,W,T\\}), with (L\\ne\\varnothing);\n- the two sharp scalar BSSC posterior-support inequalities with right side\n  (r).\n\nThere is an actual finite entropic point satisfying all these constraints for\nwhich both direct sum branches equal\n\n\\[\n\\boxed{2h_2(1/4)-\\frac54\n=0.3725562489182657\\ldots}.\n\\]\n\nConsequently, adding any collection of universally valid finite-variable\ninformation inequalities, including unknown non-Shannon inequalities, cannot\nlower this relaxation below that value.  Nor can any finite sequence of\nstandard copy-lemma extensions: each copy step can be realized by conditional\nresampling of the finite witness while preserving its original marginal and\nobjective.\n\nThe witness is deliberately not a binary BSSC distribution.  Its (X) is a\ntuple of six nondegenerate independent binary components.  Exact binary-\nposterior or other channel-specific consistency constraints exclude it and\nremain viable.  The theorem obstructs only the stated entropy/copy refinement\nroute.",
      "dependencyTransactionIds": []
    }
  ],
  "evidenceManifestDigest": "sha256:4851a0687f975a125a86eb07e04c2365aa09a4f502571b0813cf8148fd3da7ee",
  "submissionInputDigest": "sha256:816e75038ad588b9b07ec2a4eafd07d3860cdc93eb3d526481b3d9f8c3833c79"
}
